{
  "schema_version": 1,
  "id": "classic-02",
  "name": "Classic Stage 2",
  "source": {
    "repository": "https://github.com/duckycodess/Battle-City",
    "revision": "5c9d81cd0de89a05f5946448d19c40fb343b0a2d",
    "path": "assets/stage.py"
  },
  "grid": {
    "width": 16,
    "height": 16,
    "rows": [
      "0000000000000000",
      "0000000000000000",
      "0020000000000200",
      "0200255555520020",
      "0020212222120200",
      "0200255555520020",
      "0000000000000000",
      "0000022222200000",
      "0300000000000400",
      "0111000000022222",
      "0202001010077002",
      "0202000200077002",
      "0772001010020002",
      "2222000000011111",
      "0000002220000000",
      "7777772827777777"
    ]
  },
  "spawns": {
    "players": [
      {
        "slot": 1,
        "x": 13,
        "y": 12
      }
    ],
    "enemies": [
      {
        "x": 0,
        "y": 0
      },
      {
        "x": 15,
        "y": 0
      }
    ]
  }
}
